[
  {
    "id": 1,
    "loan_number": "PRE-0000001",
    "customer_id": 747,
    "loan_type": "mortgage",
    "principal": 257800.0,
    "annual_rate": 2.54,
    "term_months": 360,
    "monthly_payment": 1023.99,
    "started_on": "2024-10-01",
    "status": "active"
  },
  {
    "id": 2,
    "loan_number": "PRE-0000002",
    "customer_id": 460,
    "loan_type": "auto",
    "principal": 20900.0,
    "annual_rate": 5.54,
    "term_months": 48,
    "monthly_payment": 486.44,
    "started_on": "2023-10-01",
    "status": "active"
  },
  {
    "id": 3,
    "loan_number": "PRE-0000003",
    "customer_id": 660,
    "loan_type": "student",
    "principal": 6900.0,
    "annual_rate": 5.11,
    "term_months": 60,
    "monthly_payment": 130.56,
    "started_on": "2020-12-01",
    "status": "defaulted"
  },
  {
    "id": 4,
    "loan_number": "PRE-0000004",
    "customer_id": 195,
    "loan_type": "student",
    "principal": 17000.0,
    "annual_rate": 4.64,
    "term_months": 36,
    "monthly_payment": 506.76,
    "started_on": "2019-04-01",
    "status": "active"
  },
  {
    "id": 5,
    "loan_number": "PRE-0000005",
    "customer_id": 270,
    "loan_type": "personal",
    "principal": 10100.0,
    "annual_rate": 10.26,
    "term_months": 12,
    "monthly_payment": 889.17,
    "started_on": "2021-04-01",
    "status": "active"
  },
  {
    "id": 6,
    "loan_number": "PRE-0000006",
    "customer_id": 749,
    "loan_type": "auto",
    "principal": 25800.0,
    "annual_rate": 8.82,
    "term_months": 84,
    "monthly_payment": 412.75,
    "started_on": "2024-06-01",
    "status": "active"
  },
  {
    "id": 7,
    "loan_number": "PRE-0000007",
    "customer_id": 410,
    "loan_type": "mortgage",
    "principal": 394900.0,
    "annual_rate": 4.28,
    "term_months": 360,
    "monthly_payment": 1949.61,
    "started_on": "2019-09-01",
    "status": "active"
  },
  {
    "id": 8,
    "loan_number": "PRE-0000008",
    "customer_id": 643,
    "loan_type": "personal",
    "principal": 20700.0,
    "annual_rate": 12.49,
    "term_months": 12,
    "monthly_payment": 1843.92,
    "started_on": "2024-06-01",
    "status": "active"
  },
  {
    "id": 9,
    "loan_number": "PRE-0000009",
    "customer_id": 461,
    "loan_type": "mortgage",
    "principal": 184300.0,
    "annual_rate": 2.65,
    "term_months": 240,
    "monthly_payment": 990.13,
    "started_on": "2021-12-01",
    "status": "active"
  },
  {
    "id": 10,
    "loan_number": "PRE-0000010",
    "customer_id": 552,
    "loan_type": "personal",
    "principal": 16800.0,
    "annual_rate": 11.05,
    "term_months": 36,
    "monthly_payment": 550.41,
    "started_on": "2022-06-01",
    "status": "paid_off"
  },
  {
    "id": 11,
    "loan_number": "PRE-0000011",
    "customer_id": 58,
    "loan_type": "auto",
    "principal": 37300.0,
    "annual_rate": 8.27,
    "term_months": 36,
    "monthly_payment": 1173.5,
    "started_on": "2019-03-01",
    "status": "active"
  },
  {
    "id": 12,
    "loan_number": "PRE-0000012",
    "customer_id": 708,
    "loan_type": "auto",
    "principal": 42200.0,
    "annual_rate": 7.36,
    "term_months": 72,
    "monthly_payment": 726.79,
    "started_on": "2023-04-01",
    "status": "active"
  },
  {
    "id": 13,
    "loan_number": "PRE-0000013",
    "customer_id": 669,
    "loan_type": "auto",
    "principal": 8600.0,
    "annual_rate": 6.61,
    "term_months": 36,
    "monthly_payment": 264.01,
    "started_on": "2023-12-01",
    "status": "active"
  },
  {
    "id": 14,
    "loan_number": "PRE-0000014",
    "customer_id": 519,
    "loan_type": "personal",
    "principal": 7700.0,
    "annual_rate": 12.14,
    "term_months": 36,
    "monthly_payment": 256.27,
    "started_on": "2024-09-01",
    "status": "active"
  },
  {
    "id": 15,
    "loan_number": "PRE-0000015",
    "customer_id": 196,
    "loan_type": "mortgage",
    "principal": 165000.0,
    "annual_rate": 2.54,
    "term_months": 240,
    "monthly_payment": 877.56,
    "started_on": "2019-06-01",
    "status": "defaulted"
  },
  {
    "id": 16,
    "loan_number": "PRE-0000016",
    "customer_id": 370,
    "loan_type": "auto",
    "principal": 44400.0,
    "annual_rate": 6.55,
    "term_months": 72,
    "monthly_payment": 747.42,
    "started_on": "2021-06-01",
    "status": "active"
  },
  {
    "id": 17,
    "loan_number": "PRE-0000017",
    "customer_id": 368,
    "loan_type": "personal",
    "principal": 22900.0,
    "annual_rate": 8.71,
    "term_months": 48,
    "monthly_payment": 566.72,
    "started_on": "2025-02-01",
    "status": "active"
  },
  {
    "id": 18,
    "loan_number": "PRE-0000018",
    "customer_id": 529,
    "loan_type": "mortgage",
    "principal": 327000.0,
    "annual_rate": 2.99,
    "term_months": 300,
    "monthly_payment": 1548.97,
    "started_on": "2022-01-01",
    "status": "active"
  },
  {
    "id": 19,
    "loan_number": "PRE-0000019",
    "customer_id": 190,
    "loan_type": "personal",
    "principal": 13200.0,
    "annual_rate": 8.43,
    "term_months": 36,
    "monthly_payment": 416.26,
    "started_on": "2024-12-01",
    "status": "paid_off"
  },
  {
    "id": 20,
    "loan_number": "PRE-0000020",
    "customer_id": 80,
    "loan_type": "personal",
    "principal": 19200.0,
    "annual_rate": 10.09,
    "term_months": 12,
    "monthly_payment": 1688.79,
    "started_on": "2023-07-01",
    "status": "paid_off"
  },
  {
    "id": 21,
    "loan_number": "PRE-0000021",
    "customer_id": 259,
    "loan_type": "personal",
    "principal": 26900.0,
    "annual_rate": 11.53,
    "term_months": 48,
    "monthly_payment": 702.19,
    "started_on": "2019-03-01",
    "status": "active"
  },
  {
    "id": 22,
    "loan_number": "PRE-0000022",
    "customer_id": 104,
    "loan_type": "personal",
    "principal": 4600.0,
    "annual_rate": 8.6,
    "term_months": 36,
    "monthly_payment": 145.42,
    "started_on": "2020-05-01",
    "status": "active"
  },
  {
    "id": 23,
    "loan_number": "PRE-0000023",
    "customer_id": 435,
    "loan_type": "personal",
    "principal": 29400.0,
    "annual_rate": 12.34,
    "term_months": 48,
    "monthly_payment": 779.13,
    "started_on": "2021-04-01",
    "status": "active"
  },
  {
    "id": 24,
    "loan_number": "PRE-0000024",
    "customer_id": 125,
    "loan_type": "personal",
    "principal": 21100.0,
    "annual_rate": 8.68,
    "term_months": 24,
    "monthly_payment": 960.85,
    "started_on": "2024-01-01",
    "status": "active"
  },
  {
    "id": 25,
    "loan_number": "PRE-0000025",
    "customer_id": 552,
    "loan_type": "auto",
    "principal": 27800.0,
    "annual_rate": 8.97,
    "term_months": 60,
    "monthly_payment": 576.68,
    "started_on": "2023-03-01",
    "status": "paid_off"
  },
  {
    "id": 26,
    "loan_number": "PRE-0000026",
    "customer_id": 403,
    "loan_type": "auto",
    "principal": 14300.0,
    "annual_rate": 8.01,
    "term_months": 36,
    "monthly_payment": 448.18,
    "started_on": "2023-09-01",
    "status": "active"
  },
  {
    "id": 27,
    "loan_number": "PRE-0000027",
    "customer_id": 609,
    "loan_type": "personal",
    "principal": 26800.0,
    "annual_rate": 8.39,
    "term_months": 48,
    "monthly_payment": 659.18,
    "started_on": "2019-02-01",
    "status": "active"
  },
  {
    "id": 28,
    "loan_number": "PRE-0000028",
    "customer_id": 607,
    "loan_type": "mortgage",
    "principal": 256600.0,
    "annual_rate": 4.32,
    "term_months": 180,
    "monthly_payment": 1939.45,
    "started_on": "2019-11-01",
    "status": "paid_off"
  },
  {
    "id": 29,
    "loan_number": "PRE-0000029",
    "customer_id": 630,
    "loan_type": "auto",
    "principal": 41500.0,
    "annual_rate": 6.83,
    "term_months": 84,
    "monthly_payment": 622.9,
    "started_on": "2022-05-01",
    "status": "active"
  },
  {
    "id": 30,
    "loan_number": "PRE-0000030",
    "customer_id": 520,
    "loan_type": "auto",
    "principal": 14000.0,
    "annual_rate": 6.44,
    "term_months": 84,
    "monthly_payment": 207.49,
    "started_on": "2022-02-01",
    "status": "active"
  },
  {
    "id": 31,
    "loan_number": "PRE-0000031",
    "customer_id": 655,
    "loan_type": "auto",
    "principal": 42000.0,
    "annual_rate": 5.81,
    "term_months": 60,
    "monthly_payment": 808.27,
    "started_on": "2024-09-01",
    "status": "paid_off"
  },
  {
    "id": 32,
    "loan_number": "PRE-0000032",
    "customer_id": 778,
    "loan_type": "auto",
    "principal": 9900.0,
    "annual_rate": 8.52,
    "term_months": 60,
    "monthly_payment": 203.21,
    "started_on": "2023-05-01",
    "status": "active"
  },
  {
    "id": 33,
    "loan_number": "PRE-0000033",
    "customer_id": 337,
    "loan_type": "personal",
    "principal": 24400.0,
    "annual_rate": 11.06,
    "term_months": 24,
    "monthly_payment": 1137.91,
    "started_on": "2020-11-01",
    "status": "active"
  },
  {
    "id": 34,
    "loan_number": "PRE-0000034",
    "customer_id": 204,
    "loan_type": "mortgage",
    "principal": 271700.0,
    "annual_rate": 4.58,
    "term_months": 360,
    "monthly_payment": 1389.61,
    "started_on": "2019-11-01",
    "status": "active"
  },
  {
    "id": 35,
    "loan_number": "PRE-0000035",
    "customer_id": 702,
    "loan_type": "personal",
    "principal": 11700.0,
    "annual_rate": 8.75,
    "term_months": 12,
    "monthly_payment": 1021.83,
    "started_on": "2023-01-01",
    "status": "active"
  },
  {
    "id": 36,
    "loan_number": "PRE-0000036",
    "customer_id": 790,
    "loan_type": "personal",
    "principal": 24800.0,
    "annual_rate": 10.91,
    "term_months": 60,
    "monthly_payment": 538.1,
    "started_on": "2022-09-01",
    "status": "defaulted"
  },
  {
    "id": 37,
    "loan_number": "PRE-0000037",
    "customer_id": 130,
    "loan_type": "student",
    "principal": 12000.0,
    "annual_rate": 5.08,
    "term_months": 36,
    "monthly_payment": 360.08,
    "started_on": "2021-06-01",
    "status": "active"
  },
  {
    "id": 38,